Name,Category,Type,Sequence Type,Sequence,Notes
6xHis-tag,Purification Tag,Protein Tag,Protein,HHHHHH,C-terminal or N-terminal; binds Ni-NTA resin
3xFLAG-tag,Purification/Detection Tag,Protein Tag,Protein,YPYDVPDYAYPYDVPDYAYPYDVPDYA,Triple FLAG for enhanced detection sensitivity
HA-tag,Detection Tag,Protein Tag,Protein,YPYDVPDYA,9 aa (YPYDVPDYA); derived from influenza hemagglutinin
Myc-tag,Detection Tag,Protein Tag,Protein,EQKLISEEDL,10 aa (EQKLISEEDL); recognized by 9E10 antibody
V5-tag,Detection Tag,Protein Tag,Protein,GKPIPNPLLGLDST,14 aa (GKPIPNPLLGLDST); derived from P/V-C protein of SV5
P2A,Self-Cleaving Peptide,Linker/Separator,Protein,GSGATNFSLLKQAGDVEENPGP,2A peptide from porcine teschovirus-1; ~98% cleavage efficiency; preferred for co-expression
T2A,Self-Cleaving Peptide,Linker/Separator,Protein,GSGEGRGSLLTCGDVEENPGP,2A peptide from Thosea asigna virus 2A; high efficiency cleavage
E2A,Self-Cleaving Peptide,Linker/Separator,Protein,GSGQCTNYALLKLAGDVESNPGP,2A peptide from equine rhinitis A virus
F2A,Self-Cleaving Peptide,Linker/Separator,Protein,GSGVKQTLNFDLLKLAGDVESNPGP,2A peptide from foot-and-mouth disease virus
SV40-NLS,Nuclear Localization Signal,Trafficking,Protein,PKKKRKV,Directs protein to nucleus; from SV40 Large T antigen (mammals/humans)
NES-PKI,Nuclear Export Signal,Trafficking,Protein,DIDELALKFAGLDL,Leucine-rich NES from cAMP-dependent protein kinase inhibitor
COX-VIII,Trafficking Signal,Trafficking,Protein,MSVLTPLLLRGLTGSARRLPVPRAK,Directs protein to mitochondrial matrix; from cytochrome c oxidase subunit VIII
KDEL,Subcellular Targeting,Trafficking,Protein,KDEL,C-terminal Retains soluble proteins in ER lumen
LoxP-site,Recombination,Cre/Lox,DNA,ATAACTTCGTATA-GCATACAT-TATACGAAGTTAT,34 bp Cre recombinase recognition site; used for conditional knockouts/inversions
FRT-site,Recombination,Flp/FRT,DNA,GAAGTTCCTATTCtctagaaaGAATAGGAACTTC,34 bp Flp recombinase recognition site
Puro,Selection/Separation,Antibiotic Resistance,Protein,MTEYKPTVRLATRDDVPRAVRTLAAAFADYPATRHTVDPDRHIERVTELQELFLTRVGLDIGKVWVADDGAAVAVWTTPESVEAGAVFAEIGPRMAELSGSRLAAQQQMEGLLAPHRPKEPAWFLATVGVSPDHQGKGLGSAVVLPGVEAAERAGVPAFLETSAPRNLPFYERLGFTVTADVEVPEGPRTWCMTRKPGA,makes immune to puromycin for selection
WPRE,Regulatory Element,Post-transcriptional,DNA,GCCACGGCGGAACTCATCGCCGCCTGCCTTGCCCGCTGCTGGACAGGGGCTCGGCTGTTGGGCACTGACAATTCCGTGGT,"Place after stop codon, but before poly A tail. Woodchuck hepatitis post-transcriptional regulatory element; enhances mRNA stability and nuclear export"
IAA7-degron,Inducible Degradation,Degron,DNA,GFSETVDLMLNLQSNKEGSVDLKNVSAVPKEKTTLKDPSKPPAKAQVVGWPPVRNYRKNMMTQQKTSS,"Auxin-inducible degron; rapid degradation with auxin/IAA addition, from plants"
SpyTag,Covalent Conjugation,Isopeptide Bond,Protein,AHIVMVDAYKPTK,(permanently bonds with SpyCatcher) Forms spontaneous isopeptide bond; used for modular protein assembly
SpyCatcher,Covalent Conjugation,Isopeptide Bond,Protein,VDTLSGLSSEQGQSGDMTIEEDSATHIKFSKRDEDGKELAGATMELRDSSGKTISTWISDGQVKDFYLYPGKYTFVETAAPDGYEVATAITFTVNEQGQVTVNGKATKGDAHI,(permanently bonds with SpyTag) Forms spontaneous isopeptide bond; used for modular protein assembly
pUC-ori,Origin of Replication,Bacterial,DNA,tttccataggctccgcccccctgacgagcatcacaaaaatcgacgctcaagtcagaggtggcgaaacccgacaggactataaagataccaggcgtttccccctggaagctccctcgtgcgctctcctgttccgaccctgccgcttaccggatacctgtccgcctttctcccttcgggaagcgtggcgctttctcatagctcacgctgtaggtatctcagttcggtgtaggtcgttcgctccaagctgggctgtgtgcacgaaccccccgttcagcccgaccgctgcgccttatccggtaactatcgtcttgagtccaacccggtaagacacgacttatcgccactggcagcagccactggtaacaggattagcagagcgaggtatgtaggcggtgctacagagttcttgaagtggtggcctaactacggctacactagaaggacagtatttggtatctgcgctctgctgaagccagttaccttcggaaaaagagttggtagctcttgatccggcaaacaaaccaccgctggtagcggtggtttttttgtttgcaagcagcagattacgcgcagaaaaaaaggatctcaa,High copy bacterial ori (~500-700 copies/cell)
f1-ori,Origin of Replication,Phage,DNA,ACGCGCCCTGTAGCGGCGCATTAAGCGCGGCGGGTGTGGTGGTTACGCGCAGCGTGACCGCTACACTTGCCAGCGCCCTAGCGCCCGCTCCTTTCGCTTTCTTCCCTTCCTTTCTCGCCACGTTCGCCGGCTTTCCCCGTCAAGCTCTAAATCGGGGGCTCCCTTTAGGGTTCCGATTTAGTGCTTTACGGCACCTCGACCCCAAAAAACTTGATTAGGGTGATGGTTCACGTAGTGGGCCATCGCCCTGATAGACGGTTTTTCGCCCTTTGACGTTGGAGTCCACGTTCTTTAATAGTGGACTCTTGTTCCAAACTGGAACAACACTCAACCCTATCTCGGTCTATTCTTTTGATTTATAAGGGATTTTGCCGATTTCGGCCTATTGGTTAAAAAATGAGCTGATTTAACAAAAATTTAACGCGAATTTTAACAAAATATTAACGCTTACAATTT,Allows single-stranded phage rescue; present in many cloning vectors
ColE1-ori,Origin of Replication,Bacterial,DNA,ttgagatcctttttttctgcgcgtaatctgctgcttgcaaacaaaaaaaccaccgctaccagcggtggtttgtttgccggatcaagagctaccaactctttttccgaaggtaactggcttcagcagagcgcagataccaaatactgtccttctagtgtagccgtagttaggccaccacttcaagaactctgtagcaccgcctacatacctcgctctgctaatcctgttaccagtggctgctgccagtggcgataagtcgtgtcttaccgggttggactcaagacgatagttaccggataaggcgcagcggtcgggctgaacggggggttcgtgcacacagcccagcttggagcgaacgacctacaccgaactgagatacctacagcgtgagctatgagaaagcgccacgcttcccgaagggagaaaggcggacaggtatccggtaagcggcagggtcggaacaggagagcgcacgagggagcttccagggggaaacgcctggtatctttatagtcctgtcgggtttcgccacctctgacttgagcgtcgatttttgtgatgctcgtcaggggggcggagcctatggaaa,Medium copy ori; basis for pUC and many plasmid backbones
AmpR,Antibiotic Resistance,Bacterial Selection,Protein,MSIQHFRVALIPFFAAFCLPVFAHPETLVKVKDAEDQLGARVGYIELDLNSGKILESFRPEERFPMMSTFKVLLCGAVLSRIDAGQEQLGRRIHYSQNDLVEYSPVTEKHLTDGMTVRELCSAAITMSDNTAANLLLTTIGGPKELTAFLHNMGDHVTRLDRWEPELNEAIPNDERDTTMPVAMATTLRKLLTGELLTLASRQQLIDWMEADKVAGPLLRSALPAGWFIADKSGAGERGSRGIIAALGPDGKPSRIVVIYTTGSQATMDERNRQIAEIGASLIKHW,Ampicillin/carbenicillin resistance; most common bacterial selection
KanR,Antibiotic Resistance,Bacterial/Mammalian Selection,Protein,MAKMRISPELKKLIEKYRCVKDTEGMSPAKVYKLVGENENLYLKMTDSRYKGTTYDVEREKDMMLWLEGKLPVPKVLHFERHDGWSNLLMSEADGVLCSEEYEDEQSPEKIIELYAECIRLFHSIDISDCPYTNSLDSRLAELDYLLNNDLADVDCENWEEDTPFKDPRELYDFLKTEKPEEELVFSHGDLGDSNIFVKDGKVSGFIDLGRSGRADKWYDIAFCVRSIREDIGEEQYVELFFDLLGIKPDWEKIKYYILLDELF,Kanamycin resistance (bacteria); neomycin/G418 resistance (mammalian)
PuroR,Antibiotic Resistance,Mammalian Selection,Protein,MTEYKPTVRLATRDDVPRAVRTLAAAFADYPATRHTVDPDRHIERVTELQELFLTRVGLDIGKVWVADDGAAVAVWTTPESVEAGAVFAEIGPRMAELSGSRLAAQQQMEGLLAPHRPKEPAWFLATVGVSPDHQGKGLGSAVVLPGVEAAERAGVPAFLETSAPRNLPFYERLGFTVTADVEVPEGPRTWCMTRKPGA,Puromycin resistance; fast selection (2-3 days)
HygroR,Antibiotic Resistance,Mammalian Selection,Protein,MKKPELTATSVEKFLIEKFDSVSDLMQLSEGEESRAFSFDVGGRGYVLRVNSCADGFYKDRYVYRHFASAALPIPEVLDIGEFSESLTYCISRRAQGVTLQDLPETELPAVLQPVAEAMDAIAAADLSQTSGFGPFGPQGIGQYTTWRDFICAIADPHVYHWQTVMDDTVSASVAQALDELMLWAEDCPEVRHLVHADFGSNNVLTDNGRITAVIDWSEAMFGDSQYEVANIFFWRPWLACMEQQTRYFERRHPELAGSPRLRAYMLRIGLDQLYQSLVDGNFDDAAWAQGRCDAIVRSGAGTVGRTQIARRSAAVWTDGCVEVLADSGNRRPSTRPRAKE,Hygromycin B resistance
GST_tag,Purification Tag,Protein Tag,Protein,MSPILGYWKIKGLVQPTRLLLEYLEEKYEEHLYERDEGDKWRNKKFELGLEFPNLPYYID GDVKLTQSMAIIRYIADKHNMLGGCPKERAEISMLEGAVLDIRYGVSRIAYSKDFETLKVDFLSKLPEMLKMFEDRLCHKTYLNGDHVTHPDFMLYDALDVVLYMDPMCLDAFPKLVCFKKRIEAIPQIDKYLKSSKYIAWPLQGWQATFGGGDHPPKSD,Glutathione S-transferase; binds glutathione resin; large (~26 kDa)
SUMO_tag,Solubility Tag,Protein Tag,Protein,MDVPATTEDVKESAESITVRVRDQTGEETFFKIKKTTKMQKVFETYATRKGVQVNSLRFLLDGDRITPDQTPKMLELEDQDQIDCVLEQTGGKGHGQIGAAAQ,Enhances solubility; cleaved by SUMO protease leaving no extra residues
Strep-tag-II,Purification Tag,Protein Tag,Protein,WSHPQFEK,8 aa; binds Strep-Tactin; gentle elution with desthiobiotin
SBP-tag,Purification Tag,Protein Tag,Protein,MDEKTTGWRGGHVVEGLAGELEQLRARLEHHPQGQREP,Streptavidin-binding peptide; 38 aa; binds streptavidin
cHS4,Insulator From Chromatin Binding,Insulator,DNA,GAGCTCACGGGGACAGCCCCCCCCCAAAGCCCCCAGGGATGTAATTACGTCCCTCCCCCGCTAGGGGGCA GCAGCGAGCCGCCCGGGGCTCCGCTCCGGTCCGGCGCTCCCCCCGCATCCCCGAGCCGGCAGCGTGCGGG GACAGCCCGGGCACGGGGAAGGTGGCACGGGATCGCTTTCCTCTGAACGCTTCTCGCTGCTCTTTGAGCC TGCAGACACCTGGGGGGATACGGGGAAAAAGCTTTAGGCTGAAAGAGAGATTTAGAATGACAGAATCATA GAACGGCCTGGGTTGCAAAGGAGCACAGTGCTCATCCAGATCCAACCCCCTGCTATGTGCAGGGTCATCA ACCAGCAGCCCAGGCTGCCCAGAGCCACATCCAGCCTGGCCTTGAATGCCTGCAGGGATGGGGCATCCAC AGCCTCCTTGGGCAACCTGTTCAGTGCGTCACCACCCTCTGGGGGAAAAACTGCCTCCTCATATCCAACC CAAACCTCCCCTGTCTCAGTGTAAAGCCATTCCCCCTTGTCCTATCAAGGGGGAGTTTGCTGTGACATTG TTGGTCTGGGGTGACACATGTTTGCCAATTCAGTGCATCACGGAGAGGCAGATCTTGGGGATAAGGAAGT GCAGGACAGCATGGACGTGGGACATGCAGGTGTTGAGGGCTCTGGGACACTCTCCAAGTCACAGCGTTCA GAACAGCCTTAAGGATAAGAAGATAGGATAGAAGGACAAAGAGCAAGTTAAAACCCAGCATGGAGAGGAG CACAAAAAGGCCACAGACACTGCTGGTCCCTGTGTCTGAGCCTGCATGTTTGATGGTGTCTGGATGCAAG CAGAAGGGGTGGAAGAGCTTGCCTGGAGAGATACAGCTGGGTCAGTAGGACTGGGACAGGCAGCTGGAGA ATTGCCATGTAGATGTTCATACAATCGTCAAATCATGAAGGCTGGAAAAGCCCTCCAAGATCCCCAAGAC CAACCCCAACCCACCCACCGTGCCCACTGGCCATGTCCCTCAGTGCCACATCCCCACAGTTCTTCATCAC CTCCAGGGACGGTGACCCCCCCACCTCCGTGGGCAGCTGTGCCACTGCAGCACCGCTCTTTGGAGAAGGT AAATCTTGCTAAATCCAGCCCGACCCTCCCCTGGCACAACGTAAGGCCATTATCTCTCATCCAACTCCAG GACGGAGTCAGTGAGAATATT,Can be used to wrap genes to prevent heterochromatin silencing
MCS,Multiple Cloning Site,Restriction Enzyme site,DNA,GAATTCGAGCTCGGTACCTCGCGAATGCATCTAGATATCGGATCCCGGGCCCGTCGACTGCAGAGGCCTGCATGCAAGCTT,Contains many restriction enzyme sites for easy custom directed insertions
Plrigid,Link Protein Complexes,Peptide Linker,Protein,EAAAREAAAREAAAREAAAR,Rigid Peptide linker
10aa-TF-Linker,Link Protein Complexes,Peptide Linker,Protein,GENLYFQSGG,Flexible peptide linker designed for synthetic TFs
Frieberg-Standard-Linker,Link Protein Complexes,Peptide Linker,Protein,GGGGSGGGGSGGGGS,Standard Protein Linker
Short-linker,Link Protein Complexes,Peptide Linker,Protein,GGSG,Standard Linker
Medium-linker,Link Protein Complexes,Peptide Linker,Protein,GGSGGGSG,Standard Linker
Long-linker,Link Protein Complexes,Peptide Linker,Protein,GGSGGGSGGGSG,Standard Linker